song,artist,tags,lyrics
Stick Season,Noah Kahan,"['pop', 'alternative', 'jazz', 'blues', 'rock', 'r&b', 'hip hop', 'dance']","46 ContributorsTranslationsالعربيةEspañolStick Season Lyrics
As you promised me that I was more than all the miles combined
You must've had yourself a change of heart like halfway through the drive
Because your voice trailed off exactly as you passed my exit sign
Kept on drivin' straight and left our future to the right
Now I am stuck between my anger and the blame that I can't face
And memories are somethin' even smoking weed does not replace
And I am terrified of weather 'cause I see you when it rains
Doc told me to travel, but there's Covid on the planes

And I love Vermont, but it's the season of the sticks
And I saw your mom, she forgot that I existed
And it's half my fault, but I just like to play the victim
I'll drink alcohol 'til my friends come home for Christmas
And I'll dream each night of some version of you
That I might not have, but I did not lose
Now you're tire tracks and one pair of shoes
And I'm split in half, but that'll have to do

So I thought that if I piled something good on all my bad
That I could cancel out the darkness I inherited from Dad
No, I am no longer funny 'cause I miss the way you laugh
You once called me ""forever,"" now you still can't call me back
See Noah Kahan LiveGet tickets as low as $25You might also like
And I love Vermont, but it's the season of the sticks
And I saw your mom, she forgot that I existed
And it's half my fault, but I just like to play the victim
I'll drink alcohol 'til my friends come home for Christmas
And I'll dream each night of some version of you
That I might not have, but I did not lose
Now you're tire tracks and one pair of shoes
And I'm split in half, but that'll have to do

Oh, that'll have to do
My other half was you
I hope this pain's just passin' through
But I doubt it

And I love Vermont, but it's the season of the sticks
And I saw your mom, she forgot that I existed
And it's half my fault, but I just like to play the victim
I'll drink alcohol 'til my friends come home for Christmas
And I'll dream each night of some version of you
That I might not have, but I did not lose
Now you're tire tracks and one pair of shoes
And I'm split in half, but that'll have to do
Have to do6Embed"
Lover,Taylor Swift,"['pop', 'r&b', 'alternative', 'blues', 'rock', 'jazz', 'dance', 'hip hop']","175 ContributorsTranslationsРусскийالعربيةУкраїнська中文NederlandsEspañolBosanskiRomânăPortuguêsPolskiItalianoDeutschFrançaisفارسیLover Lyrics
We could leave the Christmas lights up 'til January
And this is our place, we make the rules
And there's a dazzling haze, a mysterious way about you, dear
Have I known you twenty seconds or twenty years?
Can I go where you go?
Can we always be this close?
Forever and ever, ah
Take me out and take me home
You're my, my, my, my lover

We could let our friends crash in the living room
This is our place, we make the call
And I'm highly suspicious that everyone who sees you wants you
I've loved you three summers now, honey, but I want 'em all
Can I go where you go?
Can we always be this close?
Forever and ever, ah
Take me out and take me home (Forever and ever)
You're my, my, my, my lover
See Taylor Swift LiveGet tickets as low as $185You might also like
Ladies and gentlemen, will you please stand?
With every guitar string scar on my hand
I take this magnetic force of a man to be my lover
My heart's been borrowed and yours has been blue
All's well that ends well to end up with you
Swear to be overdramatic and true to my lover
And you'll save all your dirtiest jokes for me
And at every table, I'll save you a seat, lover
Can I go where you go?
Can we always be this close?
Forever and ever, ah
Take me out and take me home (Forever and ever)
You're my, my, my, my
Oh, you're my, my, my, my
Darling, you're my, my, my, my lover134Embed"
PRIDE.,Kendrick Lamar,"['hip hop', 'r&b']","303 ContributorsTranslationsTürkçeEspañolPortuguêsFrançaisDeutschPRIDE. Lyrics
Love's gonna get you killed
But pride’s gonna be the death of you and you and me
And you and you and you and me
And you and you and you and me
And you and you and you and me and—

Me, I wasn't taught to share, but care
In another life, I surely was there
Me, I wasn't taught to share, but care
I care, I care

Hell-raising, wheel-chasing, new worldly possessions
Flesh-making, spirit-breaking, which one would you lessen?
The better part, the human heart, you love ’em or dissect 'em
Happiness or flashiness? How do you serve the question?
See, in a perfect world, I would be perfect, world
I don't trust people enough beyond they surface, world
I don't love people enough to put my faith in man
I put my faith in these lyrics, hoping I make a band
I understand I ain't perfect, I probably won't come around
This time I might put you down
Last time I ain't give a fuck, I still feel the same now
My feelings might go numb, you're dealing with cold thumb
I’m willing to give up a leg and arm to show empathy from
Pity parties and functions of you and yours
A perfect world, you probably live another 24
I can’t fake humble just 'cause your ass is insecure
I can’t fake humble just 'cause your ass is insecure
See Kendrick Lamar LiveGet tickets as low as $206You might also like
Me, I wasn't taught to share, but care
In another life, I surely was there
Me, I wasn't taught to share, but care
I care, I care
Maybe I wasn’t there (We saw you first)
Maybe I wasn't there (I saw you first)
Maybe I wasn't there (I saw you first)
Maybe I wasn't there

Now, in a perfect world, I probably won't be insensitive
Cold as December but never remember what winter did
I wouldn't blame you for mistakes I made or the bed I laid
Seems like I point the finger just to make a point nowadays
Smiles and cold stares, the temperature goes there
Indigenous disposition, feel like we belong here
I know the walls, they can listen, I wish they could talk back
The hurt becomes repetition, the love almost lost that
Sick venom in men and women overcome with pride
A perfect world is never perfect, only filled with lies
Promises are broken and more resentment come alive
Race barriers make inferior of you and I
See, in a perfect world, I'll choose faith over riches
I'll choose work over bitches, I'll make schools out of prison
I'll take all the religions and put 'em all in one service
Just to tell 'em we ain't shit, but He's been perfect, world
Me, I wasn't taught to share, but care
In another life, I surely was there
Me, I wasn't taught to share, but care
I care, I care
Maybe I wasn't there (We saw you first)
Maybe I wasn't there (I saw you first)
Maybe I wasn't there (I saw you first)
Maybe I wasn't there169Embed"
Rush,Troye Sivan,['dance'],"58 ContributorsTranslationsEspañolPortuguêsFrançaisTürkçeDeutschRush Lyrics
I feel the rush
Addicted to your touch

Big communication, tell me what you want
Translate your vibration, let your body talk to me
Baby love, if you wanna show me what
You've been schemin' up, if you wanna (Let go)
Trust the simulation, don't you let it break
Every stimulation, promise I can take
What you wanna give? Boy, you better show me what
You've been schemin' up

You got my heartbeat racin'
My body blazin'

I feel the rush
Addicted to your touch
Oh, I feel the rush
It's so good, it's so good
I feel the rush
Addicted to your touch
Oh, I feel the rush
It's so good, it's so good
See Troye Sivan LiveGet tickets as low as $59You might also like
So good when we slow gravity, so good
It's so good, it's so good
Breathe one, two, three, take all of me, so good
It's so good, it's so good

Pass your boy the heatwave, recreate the sun
Take me to the feeling, boy, you know the one
Kiss it when you're done, man, this shit is so much fun
Pocket rocket gun

You got my heartbeat (Heartbeat) racin' (Racin')
My body blazin'

I feel the rush
Addicted to your touch
Oh, I feel the rush
It's so good, it's so good
I feel the rush
Addicted to your touch
Oh, I feel the rush
It's so good, it's so good
So good when we slow gravity, so good
It's so good, it's so good
Breathe one, two, three, take all of me, so good
It's so good, it's so good

It's so good, it's so good
It's so good, it's so good6Embed"
Fade Into You,Mazzy Star,"['alternative', 'dance']","87 ContributorsFade Into You Lyrics
I wanna hold the hand inside you
I wanna take the breath that's true
I look to you and I see nothing
I look to you to see the truth
You live your life, you go in shadows
You'll come apart and you'll go blind
Some kind of night into your darkness
Colored your eyes with what's not there

Fade into you
Strange you never knew
Fade into you
I think it's strange you never knew


A stranger's light comes on slowly
A stranger's heart without a home
You put your hands into your head
And then its smiles cover your heart

Fade into you
Strange you never knew
Fade into you
I think it's strange you never knew
Fade into you
Strange you never knew
Fade into you
I think it's strange you never knew
You might also like
I think it's strange you never knew77Embed"
No Role Modelz,J. Cole,['hip hop'],"400 ContributorsTranslationsEspañolРусскийEnglishItalianoFrançaisNo Role Modelz Lyrics
First things first: rest in peace, Uncle Phil
For real
You the only father that I ever knew
I get my bitch pregnant, I'ma be a better you
Prophecies that I made way back in the Ville
Fulfilled
Listen, even back when we was broke, my team ill
Martin Luther King woulda been on Dreamville, talk to a nigga

One time for my L.A. sisters
One time for my L.A. ho
Lame niggas can't tell the difference
One time for a nigga who know

Don't save her, she don't wanna be saved
Don't save her, she don't wanna be saved
Don't save her, she don't wanna be saved
Don't save her, she don't wanna be saved

No role models, and I'm here right now
No role models to speak of
Searchin' through my memory, my memory, I couldn't find one
Last night, I was gettin' my feet rubbed by the baddest bitch
Not Trina, but I swear to God, this bitch'll make you call your girl up
And tell her, ""Hey, what's good?
Sorry, I'm never comin' home, I'ma stay for good""
Then hang the phone up and proceed to lay the wood
I came fast like 9-1-1 in white neighborhoods
Ain't got no shame 'bout it
She think I'm spoiled and I'm rich 'cause I can have any bitch
I got defensive and said, ""Nah, I was the same without it""
But then I thought back, back to a better me
Before I was a B-list celebrity
'Fore I started callin' bitches ""bitches"" so heavily
Back when you could get a platinum plaque without no melody, you wadn't sweatin' me
You might also like
One time for my L.A. sisters
One time for my L.A. ho
Lame niggas can't tell the difference
One time for a nigga who know

Don't save her, she don't wanna be saved
Don't save her, she don't wanna be saved
Don't save her, she don't wanna be saved
Don't save her, she don't wanna be saved

I want a real love, dark-skinned Aunt Viv love
That Jada and that Will love
That leave a toothbrush at your crib love
And you ain't gotta wonder whether that's your kid love
Nigga, I don't want no bitch from reality shows
Out-of-touch-with-reality hoes
Out in Hollywood bringin' back five or six hoes
Fuck 'em then we kick 'em to the do', nigga, you know how it go
She deserved that, she a bird, it's a bird trap
You think if I didn't rap she would flirt back?
Takin' off her skirt, let her wear my shirt, 'fore she leave
""I'ma need my shirt back"" (Nigga, you know how it go)
One time for my L.A. sisters
One time for my L.A. ho
Lame niggas can't tell the difference
One time for a nigga who know

Don't save her, she don't wanna be saved
Don't save her, she don't wanna be saved
Don't save her, she don't wanna be saved
Don't save her, she don't wanna be saved
There's an old saying in Tennessee—I know it's in Texas, probably in Tennessee—that says, fool me once... shame on... shame on you
Fool me—can't get fooled again

Fool me one time, shame on you (Ayy)
Fool me twice, can't put the blame on you (Ayy)
Fool me three times, fuck the peace sign
Load the chopper, let it rain on you (Bop, bop, bop)
Fool me one time, shame on you (Ayy)
Fool me twice, can't put the blame on you (Ayy)
Fool me three times, fuck the peace sign
Load the chopper, let it rain on you (Bop, bop, bop)
My only regret was too young for Lisa Bonet
My only regret was too young for Nia Long
Now all I'm left with is hoes from reality shows
Hand her a script, the bitch prolly couldn't read along
My only regret was too young for Sade Adu
My only regret, could never take Aaliyah home
Now all I'm left with is hoes up in Greystone
With the stale face 'cause they know it's they song

She shallow but the pussy deep (She shallow
She shallow)
She shallow but the pussy deep (She shallow), yeah, ayy
(She shallow)
She shallow but the pussy deep (She shallow), haha
(She shallow)
She shallow but the pussy deep (She shallow
She shallow)

Don't save her, she don't wanna be saved
Don't save her, she don't wanna be saved
Don't save her, she don't wanna be saved
Don't save her, she don't wanna be saved
Don't save her, she don't wanna be saved
Don't save her, she don't wanna be saved
Don't save her, she don't wanna be saved
Don't save her, she don't wanna be saved
1.3KEmbed"
