song,artist,tags,lyrics
Everlong,Foo Fighters,"['alternative', 'rock']","109 ContributorsTranslationsEspañolPortuguêsУкраїнськаEverlong Lyrics
Hello, I've waited here for you
Everlong
Tonight, I throw myself into
And out of the red, out of her head, she sang

Come down, and waste away with me
Down with me
Slow, how you wanted it to be
I'm over my head, out of her head, she sang

And I wonder
When I sing along with you

If everything could ever feel this real forever
If anything could ever be this good again
The only thing I'll ever ask of you
You gotta promise not to stop when I say when
She sang

Breathe out, so I can breathe you in
Hold you in
And now, I know you've always been
Out of your head, out of my head, I sang
See Foo Fighters LiveGet tickets as low as $57You might also like
And I wonder
When I sing along with you

If everything could ever feel this real forever
If anything could ever be this good again
The only thing I'll ever ask of you
You gotta promise not to stop when I say when
She sang

And I wonder

If everything could ever feel this real forever
If anything could ever be this good again
The only thing I'll ever ask of you
You gotta promise not to stop when I say when127Embed"
Die For You,The Weeknd,['pop'],"236 ContributorsTranslationsPortuguêsفارسیTürkçeEspañolDeutschРусскийDie For You Lyrics
I'm findin' ways to articulate the feelin' I'm goin' through
I just can't say I don't love you (Yeah)
'Cause I love you, yeah
It's hard for me to communicate the thoughts that I hold
But tonight, I'm gon' let you know
Let me tell the truth
Baby, let me tell the truth, yeah

You know what I'm thinkin', see it in your eyes
You hate that you want me, hate it when you cry
You're scared to be lonely, 'specially in the night
I'm scared that I'll miss you, happens every time
I don't want this feelin', I can't afford love
I try to find a reason to pull us apart
It ain't workin' 'cause you're perfect
And I know that you're worth it
I can't walk away, oh
Even though we're goin' through it
And it makes you feel alone
Just know that I would die for you
Baby, I would die for you, yeah
The distance and the time between us
It'll never change my mind 'cause
Baby, I would die for you
Baby, I would die for you, yeah (Say)
You might also like
I'm findin' ways to manipulate the feelin' you're goin' through
But, baby girl, I'm not blamin' you
Just don't blame me, too, yeah
'Cause I can't take this pain forever
And you won't find no one that's better
'Cause I'm right for you, babe
I think I'm right for you, babe

You know what I'm thinkin', see it in your eyes
You hate that you want me, hate it when you cry
It ain't workin' 'cause you're perfect
And I know that you're worth it
I can't walk away, oh
Even though we're goin' through it
And it makes you feel alone
Just know that I would die for you
Baby, I would die for you, yeah
The distance and the time between us
It'll never change my mind 'cause
Baby, I would die for you, uh
Baby, I would die for you, yeah
I would die for you, I would lie for you
Keep it real with you, I would kill for you, my baby
I'm just sayin', yeah
I would die for you, I would lie for you
Keep it real with you, I would kill for you, my baby
Na-na-na, na-na-na, na-na-na

Even though we're goin' through it
And it makes you feel alone
Just know that I would die for you
Baby, I would die for you, yeah
The distance and the time between us
It'll never change my mind 'cause
Baby, I would die for you
Baby, I would die for you, yeah (Oh, babe)
(Die for you)190Embed"
Washing Machine Heart,Mitski,"['rock', 'alternative', 'pop', 'jazz', 'blues', 'r&b', 'hip hop', 'metal', 'dance']","93 ContributorsTranslationsEspañolPortuguêsFrançaisDeutschΕλληνικάWashing Machine Heart Lyrics
Toss your dirty shoes in my washing machine heart
Baby, bang it up inside
I'm not wearing my usual lipstick
I thought maybe we would kiss tonight

Baby, will you kiss me already?
And toss your dirty shoes in my washing machine heart
Baby, bang it up inside


Baby, though I've closed my eyes
I know who you pretend I am
I know who you pretend I am

But, do-mi-ti
Why not me? Why not me?
Do-mi-ti
Why not me? Why not me?

Do-mi-ti
Why not me? Why not me?See Mitski LiveGet tickets as low as $26You might also like67Embed"
"One Of The Girls (with JENNIE, Lily Rose Depp)",The Weeknd,"['pop', 'alternative']","1 ContributorNew Music Friday 06/23/23 LyricsPeso Pluma & Junior H - LUNA
Young Thug - Oh U Went (feat. Drake)
Ice Spice & Nicki Minaj - Barbie World (with Aqua)
Bizarrap - Rauw Alejandro: Bzrp Music Sessions, Vol. 56
The Weeknd, JENNIE & Lily-Rose Depp - One Of The Girls
Coi Leray & David Guetta - Make My Day
Lyrical Lemonade, Juice WRLD & Cordae - Doomsday
Anitta - Funk Rave
Kelly Clarkson - rock hudson
Kim Petras - King of Hearts
Lil Tjay - June 22nd
Chris Brown - Summer Too Hot
Dominic Fike - Mama's Boy
Rauw Alejandro & Bizarrap - BABY HELLO
The Chainsmokers, ILLENIUM & Carlie Hanson - See You Again
Faye Webster - But Not Kiss
Hozier - Unknown / Nth
Old Dominion - Some Horses
Gwen Stefani - True Babe
Bakar - Alive!
Portugal. The Man - Grim Generation
Mac Miller - The Star Room (OG Version)
DESTIN CONRAD - To This Day🕒
Stormzy - Toxic Trait
Oliver Tree - Bounce
Maisie Peters - Run
Jake Owen - Loose Cannon
Beck - Odyssey
Carly Rae Jepsen - Shy Boy
JP Saxe - Everything Ends (feat. Lizzy McAlpine and Tiny Habits)
Nessa Barrett - lie
Demi Lovato - SWINE
Key Glock - Presidential Rolex
Finesse2tymes - Shiesty (feat. Kali & Sexyy Red)
Loud Luxury - If Only I (feat. Bebe Rexha)
Diplo - Without You
Brad Paisley - So Many Summers
Tai Verdes - Sandman
Moses Sumney - Get It B4
Slowdive - kisses
X Ambassadors & Medium Build - Friend For Life
King Von - Robberies
Joyner Lucas - Broski
Marshmello & Tiago PZK - Como Yo
Tiësto - Drifting
Madeon - Gonna Be Good
Madison Rose - True Colors
Lyn Lapid - the alternative
Sean Leon - THE GLADE
binki - Freakin
Wallice - Prepaid Wireless
Corinne Bailey Rae - New York Transit Queen
Ashley Cooke - mean girl
M. Ward - too young to die
Shania Twain - On Three
Chris Renzema - Faith!?
Palace - All We've Ever Wanted
Lennon Stella - Time After Time - Spotify Singles
Äyanna - Girlfriend
Victony - My Darling
XXXTENTACION - I'm Not Human
Danny Towers & DJ Scheme - Kreepin (feat. Denzel Curry)
Duki & Jhayco - RoCKSTAR 2.0
NCT DREAM - Broken Melodies
Valley - Natural
Geese - I See Myself
C.S. Armstrong - SOUL SURVIVOR
Byron Messia - I Hate Byron
Timmy Trumpet & Alle Farben - Good Morning (feat. YOU)
venbee - die young
Boyish & King Princess - Kill Your Pain
Bishop Briggs - Reborn
Justin Vernon - hazelton
Michael Ray - Spirits and Demons (with Meghan Patrick)
Bridge Music - FIND MY WAY
Maria Becerra - CORAZÓN VACÍO
Jason Mraz - Feel Good Too
Teddy Swims - Lose Control
Militarie Gun - Never Fucked Up Once
Rowdy Rebel, Fetty Luciano & Fivio Foreign - Posture
Big Freedia - El Niño (feat. Lil Wayne & Boyfriend)
Galantis - BANG BANG! (My Neurodivergent Anthem)
Stefflon Don - Move It
Rylo Rodriguez - Thang For You (feat. No Cap)
BLP KOSHER - Special K
Curtis Waters - PETTY (feat. TiaCorine)
Cody Fry - Waltz For Sweatpants
Healy - 2D
Aphex Twin - Blackbox Life Recorder 21f
Albert Hammond Jr - One Chance
REASON - You Betta (Jesus Take The Wheel)☑️
Sada Baby - Ugly Sweater☑️
Tyler Cole - Bad Joke
Current Joys & Your Angel - LOVE + POP
Ilsey - No California
Pecos & the Rooftops - She Says
Amy Shark - Can I Shower At Yours
Babyboy AV - Quick Question🐚
Franklin Jonas - Cherub
Dr. Teeth and The Electric Mayhem - Rock On - Spotify SinglesEmbed"
Mr. Brightside,The Killers,"['alternative', 'rock', 'metal', 'blues', 'pop', 'jazz']","232 ContributorsTranslationsDeutschMr. Brightside Lyrics
Comin' out of my cage and I been doin' just fine
Gotta, gotta be down because I want it all
It started out with a kiss, how did it end up like this?
It was only a kiss, it was only a kiss
Now I'm fallin' asleep and she's callin' a cab
While he's havin' a smoke and she's takin' a drag
Now they're goin' to bed and my stomach is sick
And it's all in my head

But she's touchin' his chest now
He takes off her dress now
Let me go
And I just can't look, it's killin' me
And takin' control

Jealousy, turnin' saints into the sea
Swimmin' through sick lullabies
Chokin' on your alibis
But it's just the price I pay
Destiny is callin' me
Open up my eager eyes
'Cause I'm Mr. Brightside
See The Killers LiveGet tickets as low as $74You might also like
I'm comin' out of my cage and I've been doin' just fine
Gotta, gotta be down because I want it all
It started out with a kiss, how did it end up like this?
(It was only a kiss) It was only a kiss
Now I'm fallin' asleep and she's callin' a cab
While he's havin' a smoke and she's takin' a drag
Now they're goin' to bed and my stomach is sick
And it's all in my head

But she's touchin' his chest now
He takes off her dress now
Let me go
'Cause I just can't look, it's killin' me
And takin' control

Jealousy, turnin' saints into the sea
Swimmin' through sick lullabies
Chokin' on your alibis
But it's just the price I pay
Destiny is callin' me
Open up my eager eyes
'Cause I'm Mr. Brightside

I never
I never
I never
I never203Embed"
Anti-Hero,Taylor Swift,"['pop', 'alternative', 'rock']","197 ContributorsTranslationsPortuguêsEspañolTürkçeFrançais中文NederlandsDeutschไทย / Phasa ThaiItalianoSvenskaУкраїнськаСрпскиBahasa IndonesiaРусскийPolskiМонголAnti-Hero Lyrics
I have this thing where I get older, but just never wiser
Midnights become my afternoons
When my depression works the graveyard shift, all of the people
I've ghosted stand there in the room

I should not be left to my own devices
They come with prices and vices
I end up in crisis
(Tale as old as time)
I wake up screaming from dreaming
One day, I'll watch as you're leaving
'Cause you got tired of my scheming
(For the last time)

It's me, hi
I'm the problem, it's me
At teatime, everybody agrees
I'll stare directly at the sun, but never in the mirror
It must be exhausting always rooting for the anti-hero

Sometimes, I feel like everybody is a sexy baby
And I'm a monster on the hill
Too big to hang out, slowly lurching toward your favorite city
Pierced through the heart, but never killed
See Taylor Swift LiveGet tickets as low as $185You might also like
Did you hear my covert narcissism I disguise as altruism
Like some kind of congressman?
(A tale as old as time)
I wake up screaming from dreaming
One day, I'll watch as you're leaving
And life will lose all its meaning
(For the last time)

It's me, hi
I'm the problem, it's me (I'm the problem, it's me)
At teatime, everybody agrees
I'll stare directly at the sun, but never in the mirror
It must be exhausting always rooting for the anti-hero

I have this dream my daughter-in-law kills me for the money
She thinks I left them in the will
The family gathers 'round and reads it and then someone screams out
""She's laughing up at us from Hell""

It's me, hi
I'm the problem, it's me
It's me, hi
I'm the problem, it's me
It's me, hi
Everybody agrees, everybody agrees
It's me, hi (Hi)
I'm the problem, it's me (I'm the problem, it's me)
At teatime (Teatime), everybody agrees (Everybody agrees)
I'll stare directly at the sun, but never in the mirror
It must be exhausting always rooting for the anti-hero69Embed"
Space Song,Beach House,"['pop', 'alternative', 'rock', 'r&b', 'blues', 'jazz', 'hip hop']","88 ContributorsTranslationsFrançaisTürkçeSpace Song Lyrics
It was late at night
You held on tight
From an empty seat
A flash of light
It will take a while
To make you smile
Somewhere in these eyes
I'm on your side
You wide-eyed girls
You get it right

Fall back into place
Fall back into place

Tender is the night
For a broken heart
Who will dry your eyes
When it falls apart?
What makes this fragile world go 'round?
Were you ever lost?
Was she ever found?
Somewhere in these eyes
You might also like
Fall back into place
Fall back into place
Fall back into place
Fall back into place
Fall back into place
Fall back into place
Fall back into place
Fall back into place
Fall back into place
Fall back into place
Fall back into place
Fall back into place
Fall back into place
Fall back into106Embed"
Let The Light In (feat. Father John Misty),Lana Del Rey,"['pop', 'rock', 'jazz', 'blues', 'alternative', 'r&b', 'hip hop', 'dance', 'metal']","1 ContributorTranslationsEnglishPortuguêsEspañolСрпскиItalianoFrançaisРусскийDeutschTürkçeفارسیहिन्दीLana Del Rey - Let The Light In (feat. Father John Misty) (Український переклад) Lyrics
Заберу тебе з дому за чверть до третьої
Питаю, чи не хочеш чогось перекусити
Катаємось, напиваємось, повторюєм знов
Буджу тебе ніччю за чверть до першої
Ніколи не можу спинитись, хочу розваг
Не поводься ти так, ніби я з тих дівчат, що в змозі заснути

Бо щоразу, як ти кажеш, що підеш
Я просто посміхаюсь, бо, милий, я вже знаю
Ти знаєш, під цим пальтом у мене нічого немає

У, впусти світло усередину
Кричу під твоїми задніми дверима, бо хочу ввійти
У, увімкни своє світло
Поглянь на нас, ти і я, знову за старе

Заїду за тобою десь за чверть до одинадцятої
Зазвичай нам нема чого робити
До біса, може, тобі слід піти записати парочку своїх пісень
Одягла обтислу сукню, бо ти знаєш, що я
Виблискую на світлі, так багато надій
На це життя і на те, як ми напишемо пісню про кохання
You might also like
У, впусти світло усередину
Кричу під твоїми задніми дверима, бо хочу ввійти
У, увімкни своє світло
Поглянь на нас, ти і я, знову за старе

Бо я люблю любити, любити, любити тебе
Я ненавиджу ненавидіти, ненавидіти, ненавидіти тебе
Увімкни «Бітлз», запали свічки, повернись у ліжко
Бо я хочу хотіти, хотіти, хотіти тебе
Мені потрібна потреба, у потребі, у потребі у тобі
Увімкни телевізор, постав квіти у вазу, ляж поруч

У, впусти світло усередину
Кричу під твоїми задніми дверима, бо хочу ввійти
У, увімкни своє світло
Поглянь на нас, ти і я, знову за стареEmbed"
Murder on the Dancefloor,Sophie Ellis-Bextor,"['dance', 'pop', 'jazz', 'alternative']","36 ContributorsTranslationsDeutschMurder on the Dancefloor Lyrics
(Murder, murder, murder…)
It's murder on the dancefloor
But you better not kill the groove
DJ, gonna burn this god-damn house right down

Oh, I know, I know, I know, I know, I know, I know, I know
About your kind
And so, and so, and so, and so, and so, and so, and so
I'll have to play

If you think you're getting away, I will prove you wrong
I'll take you all the way, boy, just come along
Hear me when I say, hey

It's murder on the dancefloor
But you better not kill the groove, hey-hey, hey-hey
It's murder on the dancefloor
But you better not steal the moves
DJ, gonna burn this god-damn house right down

Oh, I know, I know, I know, I know, I know, I know, I know
I know there may be others
And so, and so, and so, and so, and so, and so, and so
You'll just have to pray
See Sophie Ellis-Bextor LiveGet tickets as low as $76You might also like
If you think you're getting away, I will prove you wrong
I'll take you all the way, stay another song
I'll blow you all away, hey

It's murder on the dancefloor
But you better not kill the groove, hey-hey, hey-hey
It's murder on the dancefloor
But you better not steal the moves
DJ, gonna turn this house around somehow
Murder on the dancefloor (On the dancefloor)
But you better not kill the groove, hey-hey, hey-hey
It's murder on the dancefloor (On the dancefloor)
But you better not steal the moves
DJ, gonna burn this god-damn house right down


Don't think you'll get away, I will prove you wrong
I'll take you all the way, boy, just come along
Hear me when I say, hey

It's murder on the dancefloor
But you better not kill the groove
It's murder on the dancefloor
But you better not steal the moves
DJ, gonna burn this god-damn house right down
It's murder on the dancefloor
But you better not kill the groove, hey-hey, hey-hey
It's murder on the dancefloor
But you better not steal the moves
DJ, gonna burn this god-damn house right down
It's murder on the dancefloor (On the dancefloor)
But you better not kill the groove, hey-hey, hey-hey
It's murder on the dancefloor (On the dancefloor)
But you better not steal the moves
DJ, gonna burn this god-damn house right down
Oh, I know, I know, I know, I know, I know, I know, I know (On the dancefloor)
But you better not kill the groove9Embed"
Boy's a liar Pt. 2,pinkpantheress,['hip hop'],"112 ContributorsTranslationsPortuguêsTürkçeDeutschEspañolFrançaisBoy’s a liar Pt. 2 Lyrics
Take a look inside your heart, is there any room for me?
I won't have to hold my breath till you get down on one knee
Because you only want to hold me when I'm looking good enough
Did you ever feel me? Would you ever picture us?
Every time I pull my hair, well, it's only out of fear
That you'll find me ugly and one day you'll disappear because
What's the point of crying? It was never even love
Did you ever want me? Was I ever good enough?

Thе-the boy's a liar, the boy's a liar
He doеsn't see ya, you're not looking at me, boy
The boy's a liar, the boy's a liar
He doesn't see ya, you're not looking at me, boy

Good eno-o-ough, good eno-o-ough
Good eno-o-ough, good eno-o-ough
Good eno-o-ough, good eno-o-ough
Good eno-o-ough, good eno-o-ough

He say that I'm good enough (Yeah), grabbin' my duh-duh-duh
Thinkin' 'bout shit that I shouldn't've (Huh)
So I tell him there's one of me, he makin' fun of me (Ha-ha)
His girl is a bum to me (Grrah)
Like that boy is a cap
Sayin' he home, but I know where he at, like
Bet he blowin' her back
Thinkin' 'bout me 'cause he know that it's fat (Damn)
And it been what it been (Huh)
Callin' his phone like, ""Yo, send me a pin""
Duckin' my shit, 'cause he know what I'm on (Grrah)
But when he hit me, I'm not gon' respond (Grrah)
But I don't sleep enough without you
And I can't eat enough without you (Huh)
If you don't speak, does that mean we're through? (Huh)
Don't like sneaky shit that you do (Grrah)
You might also like
The-the boy's a liar, the boy's a liar
He doesn't see ya, you're not looking at me, boy
The boy's a liar, the boy's a liar
He doesn't see ya, you're not looking at me, boy

Good eno-o-ough, good eno-o-ough
Good eno-o-ough, good eno-o-ough
Good eno-o-ough, good eno-o-ough
Good eno-o-ough, good eno-o-ough25Embed"
aUgUSt,Taylor Swift,"['pop', 'alternative', 'jazz', 'rock', 'r&b', 'blues', 'hip hop', 'dance']","159 ContributorsTranslationsNederlandsTürkçeEspañolСрпскиРусскийPortuguêsفارسیItalianoMagyarDeutschFrançaisΕλληνικάRomânăPolskiУкраїнськаSvenskaSlovenščinaالعربية​august Lyrics
Salt air, and the rust on your door
I never needed anything more
Whispers of ""Are you sure?""
""Never have I ever before""

But I can see us lost in the memory
August slipped away into a moment in time
'Cause it was never mine
And I can see us twisted in bedsheets
August sipped away like a bottle of wine
'Cause you were never mine

Your back beneath the sun
Wishin' I could write my name on it
Will you call when you're back at school?
I remember thinkin' I had you

But I can see us lost in the memory
August slipped away into a moment in time
'Cause it was never mine
And I can see us twisted in bedsheets
August sipped away like a bottle of wine
'Cause you were never mine
See Taylor Swift LiveGet tickets as low as $185You might also like
Back when we were still changin' for the better
Wanting was enough
For me, it was enough
To live for the hope of it all
Cancel plans just in case you'd call
And say, ""Meet me behind the mall""
So much for summer love and saying ""us""
'Cause you weren't mine to lose
You weren't mine to lose, no

But I can see us lost in the memory
August slipped away into a moment in time
'Cause it was never mine
And I can see us twisted in bedsheets
August sipped away like a bottle of wine
'Cause you were never mine

'Cause you were never mine
Never mine
But do you remember?
Remember when I pulled up and said ""Get in the car""
And then canceled my plans just in case you'd call?
Back when I was livin' for the hope of it all, for the hope of it all
""Meet me behind the mall""
(Remember when I pulled up and said ""Get in the car"")
(And then canceled my plans just in case you'd call?)
(Back when I was livin' for the hope of it all, for the hope of it all)
(""Meet me behind the mall"")
Remember when I pulled up and said ""Get in the car""
And then canceled my plans just in case you'd call?
Back when I was livin' for the hope of it all (For the hope of it all)
For the hope of it all, for the hope of it all
(For the hope of it all, for the hope of it all)124Embed"
Popular (with Playboi Carti & Madonna) - Music from the HBO Original Series,The Weeknd,['hip hop'],"1 ContributorPopular (with Playboi Carti & Madonna) Music from the HBO Original Series LyricsI've seen the devil
Down Sunset
In every place
In every face
Yeah, uh, uh
Yeah, uh, uh
Tell me, do you see her? She's livin' her life
Even if she acts like she don't want the limelight
But if you knew her, yeah, she lives a lie
She calls the paparazzi, then she acts surprised, oh
Oh, I know what she needs (oh-oh)
She just want the fame, I know what she fiends (oh-oh)
Give hеr a little taste, runnin' back to me (oh-oh)
Put it in hеr veins, pray her soul to keep, ooh-ooh
Ooh-ooh, every night (every night)
She prays to the sky
Flashin' lights
Is all she ever wanted
Beggin' on her knees to be popular
That's her dream, to be popular (huh)
Kill anyone to be popular
Sell her soul to be popular (popular)
Just to be popular (uh-huh)
Everybody scream 'cause she popular (huh)
She mainstream 'cause she popular
Never be free 'cause she popular
Money on top of me, money on top of her (uh-huh)
Money on top of me, money on top of her (uh-huh)
Yeah, shawty fuck with me 'cause she know I'm popular (uh-huh)
Yeah, shawty fuck with me 'cause she know I'm popular
I know that you see me (huh), time's gone by
Spend my whole life runnin' from your flashin' lights
Try to own it, but I'm alright (alright)
You can't take my soul without a fuckin' fight, oh
Oh, I know what she needs (oh-oh)
She just want the fame, I know what she fiends (oh-oh)
Give her a little taste, runnin' back to me (oh-oh)
Put it in her veins, pray her soul to keep, ooh-ooh (uh)
Ooh-ooh, every night (every night)
She prays to the sky (huh)
Flashin' lights
Is all she ever wanted
Beggin' on her knees to be popular (huh)
That's her dream, to be popular (huh)
Kill anyone to be popular
Sell her soul to be popular (popular)
Just to be popular (uh-huh)
Everybody scream 'cause she popular (huh)
She mainstream 'cause she popular
Never be free 'cause she popular
Money on top of me, money on top of her (uh-huh)
Money on top of me, money on top of her (uh-huh)
Yeah, shawty fuck with me 'cause she know I'm popular (uh)
Yeah, shawty fuck with me 'cause she know I'm popular (uh)
Money on top of me, money on top of her (uh-huh)
Money on top of me, money on top of her (uh-huh)
Yeah, shawty fuck with me 'cause she know I'm popular (uh-huh)
Yeah, shawty fuck with me 'cause she know I'm popular
I'm gettin' money and I'm keepin' it
I'm gettin' cash and I'm keepin' it
Money on top of me, money on top of her
Yeah, shawty fuck with me 'cause she know I'm popular
Pop-popular, born to be popular
She in debt, 20 mill, but she run it up
She can never be broke 'cause she popular
Turn the webcam on for the followers
♪
Beggin' on her knees to be popular
That's her dream, to be popular (huh)
Kill anyone to be popular
Sell her soul to be popular (popular)
Just to be popular (uh-huh)
Everybody scream 'cause she popular (huh)
She mainstream 'cause she popular
Never be free 'cause she popularYou might also likeEmbed"
